{
  "schema_version": 1,
  "authorization_id": "win32-curvature-v2-1d6f6b4-20260909",
  "decision": "authorize_candidate_generation",
  "state": "authorized",
  "actor": {
    "id": "workspace-owner",
    "role": "owner"
  },
  "source_revision": "1d6f6b42ee41d5c14f2628ebc037749d5f45a7b5",
  "platform": "win32",
  "created_at": "2026-09-09T07:10:42.547Z",
  "failed_compare": {
    "run_id": "local-1788937781491-3538fea3",
    "summary_path": "apps/dashboard-e2e/visual-review/evidence/win32-curvature-v2-1d6f6b4-20260909/summary.json",
    "summary_sha256": "1dd7f987d5beb06374091f3ee639a3cc4a7a36437b5d1b06ecaddc589d370e77"
  },
  "scenarios": [
    {
      "scenario_id": "landing",
      "expected_path": "apps/dashboard-e2e/visual-review/evidence/win32-curvature-v2-1d6f6b4-20260909/landing-expected.png",
      "expected_sha256": "dcd5af69caaab82f2d9e06165cf268aec82b43a52cd7578d92c6380558f6c2e8",
      "actual_path": "apps/dashboard-e2e/visual-review/evidence/win32-curvature-v2-1d6f6b4-20260909/landing.png",
      "actual_sha256": "a5ba0e3506b3b7a40c565c8df3ee805339093552dfcaa63e21fc388b616d5f9c",
      "diff_path": "apps/dashboard-e2e/visual-review/evidence/win32-curvature-v2-1d6f6b4-20260909/landing-diff.png",
      "diff_sha256": "78913a659810bcbeb1fe0c60c97f281daa1acdaf9e6c035f79fb41fd13d98bd7"
    },
    {
      "scenario_id": "ticker-desktop",
      "expected_path": "apps/dashboard-e2e/visual-review/evidence/win32-curvature-v2-1d6f6b4-20260909/ticker-desktop-expected.png",
      "expected_sha256": "1c67d05182e52b711acf49f9aae97fc7f089efb6b922e680ddef2a54bfd34a30",
      "actual_path": "apps/dashboard-e2e/visual-review/evidence/win32-curvature-v2-1d6f6b4-20260909/ticker-desktop.png",
      "actual_sha256": "606ac2404be69ac4d6d1c85f547949237b2fe9301d4241535c4bc9c8e8997666",
      "diff_path": "apps/dashboard-e2e/visual-review/evidence/win32-curvature-v2-1d6f6b4-20260909/ticker-desktop-diff.png",
      "diff_sha256": "f5e8b23ce4d07b3cec7bce11caed1624005051c7bde80bd3ed8dc772fe3eed0c"
    },
    {
      "scenario_id": "ticker-offline-mobile",
      "expected_path": "apps/dashboard-e2e/visual-review/evidence/win32-curvature-v2-1d6f6b4-20260909/ticker-offline-mobile-expected.png",
      "expected_sha256": "9bcb7e46ebb6056b4310972045f60a2766956fcc9298e560138879b6ded5af75",
      "actual_path": "apps/dashboard-e2e/visual-review/evidence/win32-curvature-v2-1d6f6b4-20260909/ticker-offline-mobile.png",
      "actual_sha256": "e7092cba4f52e283eef4f310b3568a4c9db35e3dfd1131c52d6258cadac282d9",
      "diff_path": "apps/dashboard-e2e/visual-review/evidence/win32-curvature-v2-1d6f6b4-20260909/ticker-offline-mobile-diff.png",
      "diff_sha256": "18e3ce933e58f3f9f9bb3c268cea4d11c5163d4ee74856d1fb4f195d693b69a6"
    },
    {
      "scenario_id": "positions-dense",
      "expected_path": "apps/dashboard-e2e/visual-review/evidence/win32-curvature-v2-1d6f6b4-20260909/positions-dense-expected.png",
      "expected_sha256": "59ba1436fb3d7d5c38e7f671c3290137ac13ce8722bd2f556e58d2ac42f8c750",
      "actual_path": "apps/dashboard-e2e/visual-review/evidence/win32-curvature-v2-1d6f6b4-20260909/positions-dense.png",
      "actual_sha256": "eb60df53ffce76e3d34bfba98c29e6568315393bca08773996088bdd92369610",
      "diff_path": "apps/dashboard-e2e/visual-review/evidence/win32-curvature-v2-1d6f6b4-20260909/positions-dense-diff.png",
      "diff_sha256": "9f4f109a673ef447261622d3df78d8414d1058819fa068016a5cfd175eada4f6"
    },
    {
      "scenario_id": "scanner-dense",
      "expected_path": "apps/dashboard-e2e/visual-review/evidence/win32-curvature-v2-1d6f6b4-20260909/scanner-dense-expected.png",
      "expected_sha256": "dcd1ca53541dadfb34dca632252eb00d020a518fd74f2e3c241fb356de9074c8",
      "actual_path": "apps/dashboard-e2e/visual-review/evidence/win32-curvature-v2-1d6f6b4-20260909/scanner-dense.png",
      "actual_sha256": "30693321eaf699c7a700341f20bae9225fa6438f4e0fc82a38cfadd35ee19b1b",
      "diff_path": "apps/dashboard-e2e/visual-review/evidence/win32-curvature-v2-1d6f6b4-20260909/scanner-dense-diff.png",
      "diff_sha256": "29fb12113386597e12d1c9e42f78d1f4994cf075fe0021e77668e4f86f36dfec"
    },
    {
      "scenario_id": "ai-recommendation",
      "expected_path": "apps/dashboard-e2e/visual-review/evidence/win32-curvature-v2-1d6f6b4-20260909/ai-recommendation-expected.png",
      "expected_sha256": "abe4f38480153d8189e8c7ebe286c9874b81921dd2e8bfb0b7305a1c43040a48",
      "actual_path": "apps/dashboard-e2e/visual-review/evidence/win32-curvature-v2-1d6f6b4-20260909/ai-recommendation.png",
      "actual_sha256": "aec64fce4f5421370a4198fdf184121e413ffd8e972071802c32aafd02c3f8ac",
      "diff_path": "apps/dashboard-e2e/visual-review/evidence/win32-curvature-v2-1d6f6b4-20260909/ai-recommendation-diff.png",
      "diff_sha256": "8beacd98fc1ec7b25377aab9fdec9ad72be826a972f24e0eac89c6582d1cfa8d"
    }
  ]
}
